hotel_name,name,rating,review
PO HOtel Semarang,Agus Rivai,4.0,"Its nice hotel with strategic locations.. Have same building with mall its nice and cozy.. .. Service was good, park area was great.. Room is quite ok..Food standard, swimming pool at level 7th is just perfect with view..Rooms: 4/5 | Service: 4/5 | Location: 5/5 …More"
PO HOtel Semarang,Cat tseng,3.0,"Old hotel badly maintained. Pictures on the web do not serve as accurate depictions. Upon arriving on our floor the 10th floor, when the lift doors open the first thing we note is the condition of the ceiling right smack in our face. The ceiling had dark brown mould on it and parts of the ceiling had broke also. The carpet had an old moudly stench. Lift to rooms has room key scanner but not in use so anyone can come up to the rooms even non hotel guests. Why would they install a card scanner if it wasn't being used? Carpet in the corridor and rooms look worn out. Edges of bathtub have rusty edges. Tap at the sink is tough to even turn on the water. Stains on bedsheets,sofa and carpet. Bathmat, towels, face towels are actually tattered at the edges. How can the hotel still use the ammenities? No hand towels were available also. Towels look worn and greyish white. They had stains on them. Hotel did not provide glasses or cups at the bathroom for brushing teeth. Room seems to be dusty as my son's allergy acted up. Water pressure's strong except it was so hard to work the tap at the sink. Shower in the bathroom is bad. Water trickles not shower. Hot water was minimal. Yellow mould was all over the sides of the edges. Rusty cracked parts of the hand shower area had sharp parts. Very dangerous for children. Such a pity this hotel is poorly maintained. Service standarda also fall far from 5 star standards. During breakfast time we witnessed the staff clearing up the breakfast buffet at 10 and none were wearing gloves. It seems all very unhygenic. Breakfast closes at 10 and we were the laat guests for breakfast. Every staff were busy clearing up the foods. So we have to be quick to get whatever breakfast we could. Ordering from the staff for even coffee was greeted by, "" this is the last one ya Ibu this is already 10am"". If only they could keep up the hotel's so called 4 or 5star standards this hotel could be a really good stay considering the location right next to the mall. Just one stay here is enough. Totally not worth the money paid for. We didn't bother to complain to the hotel too even though we are due to check out tomorrow considering all the complaints I've read online. It seems the hotel just apologizes but does not take action. Some past complaints were months ago. Please work very much harder to make the hotel a more welcoming place for guests. I wouldn't think we will be back again. Please be warned if you decide to stay in this hotel."
PO HOtel Semarang,Raymond Tandika,1.0,The Air conditioning was not cold at all. We are literally sweating all night long. We set the temperature to the coldest one but nothing happened. Still hotRooms: 1/5 | Service: 1/5 | Location: 1/5 …More
PO HOtel Semarang,A.M S,1.0,"It's my first and will be my last stay in this hotel.The towels, bedsheets are filthy, smelly as if they're unwashed.The wifi kept dropping offline.It's a fake 5 star rating..Rooms: 2/5 | Service: 2/5 | Location: 5/5 …More"
PO HOtel Semarang,Rikza GameFreaks,3.0,"Service was great, food are okay 👍. But the furniture and facilities starting to get old for a 5 star hotel, definitely need an upgrade. Overall good experienceRooms: 3/5 | Service: 5/5 | Location: 5/5 …More"
PO HOtel Semarang,Raymond Valiant Ruritan,4.0,My stay went well. I enjoyed the acces and service of the hotel. This hotel is just atop the Paragon mall. The ambience and environment is also nice. I enjoyed my stay albeit it was short. The staff was helpful and the service is acceptable. One area of improvement is the buffet breakfast. I kindly suggest to put more attention at the CoVid-19 protocol implementation. Service staff must use handgloves and masks all the time. Visitors are required to obey the rules within the restaurant.
PO HOtel Semarang,Manoj Bhat,4.0,The hotel is a very nice place to stay in Semarang but the parking is really a problem for those who drive in. One of the worst driving lanes for parking I have seen in my life. In fact the wall and divider is so full of paint from bruises that cars before mine seem to have created a crazy graffiti that you will find hard to avoid contributing to.. A sad situation to have for a property so prime..
PO HOtel Semarang,ony,5.0,"We spend two nights in executive suite room (1006) PO hotel. Very nice experience, large room and large bath room with complete amanities. Varied food menu for breakfast. Very good.Rooms: 5/5 | Service: 5/5 | Location: 5/5 …More"
PO HOtel Semarang,Agus Hadijanto,5.0,"No more argument and doubt, the best hotel in the heart of the city of Semarang, right in the busiest locatikns and areasRooms: 5/5 | Service: 5/5 | Location: 5/5 …More"
PO HOtel Semarang,L Sam,5.0,"This hotel has changed management several times. This time is PO Hotel. What I like is its strategic location, next to the Paragon Mall. My stay was a business travel during the month of Ramadhan. The restaurant was crowded. It offered various dishes for Iftar (dinner) and way fewer dishes for sahur. The food quality was so so, but the lamb was the favourite among the guests."
PO HOtel Semarang,Abdullah Saif,2.0,"Couldve been better. We were arrived at 4pm just to found out that 2 out of 3 rooms werent ready yet. Room was old, poor maintenance, stains all over carpets, sofa, mold on the corner. Bathroom design is wrong in so many level IMO, poor design, poor execution Carpets in all floor and room (10th floor) with stains all over, and not really recommended if you have asthma or allergy. Not sure if it is because of pandemic thingy, but this hotel needs a lot of improvement to do. Such a waste of money"
PO HOtel Semarang,Miko Bayuaji,1.0,"I'm staying today (april 22nd 2022) in this hotel and planned to check out on monday april 25th 2022 but i will just check out tomorrow due to some problem with my room. My room number is 1009. I have a local rain in my room. It's such a special bonus from tropical country's hotel, which is quite famous for its heavy rain weather. They said that my room has some leakage problem with the ac and they just act like it is a regular problem. This ridiculous thing supposed to be not happened in hotel that claim has 5 star. No body apologize as it is just regular problem. They just give a cold call and weird unsincere sorry from phone after i get angry to their engineer. Even they dont pay attention to my gender call after so many times i explain them to call me mr rather than mrs / madam. The worse thing is they even dont have in room dining service after 9.30 PM. This hotel is located in central java's capital city but i really feel that i stay in a secluded village with its natural rain. Their towels are even worse. It looks like a mop rather than bath towel. To make it short, dont waste your money to stay in the hotel. You can find better hotels in semarang and cheaper. Luckily my office paid for this room. I even feel pity that my office need to pay for this stupid room."
PO HOtel Semarang,Eric Wijanta,3.0,Rooms are quite nice and neat...but the biggest let down was that the AC wasn't cold. It stayed around room temperature at approx. 26-27' C eventhough the settings were set to lowest...Rooms: 3/5 | Service: 4/5 | Location: 5/5 …More
PO HOtel Semarang,Demina Sitepu,5.0,"The room is spacious. Try the gym but no one can assist with the equipment. The location is good, next to Mall ParagonRooms: 5/5 | Service: 4/5 | Location: 5/5 …More"
PO HOtel Semarang,Henk Sentoz,2.0,"Already paid for the breakfast for three nights staying. However, every morning the restaurant staff ( for breakfast ) always tells us that our room does not include breakfast. This PO Hotel really needs improvement in serviceRooms: 5/5 | Service: 2/5 | Location: 5/5 …More"
PO HOtel Semarang,Angela Liu,1.0,"Dirty, not clean, old, linen is broken, can not even cover the mattress, service is bad, should be minus 5 star. I do not understand why it is 4 star hotel"
PO HOtel Semarang,Sambang P.,5.0,"This is great beautiful Hotel at Central Semarang, Nice Clean with MallRooms: 5/5 | Service: 5/5 | Location: 5/5Hotel highlights Luxury, Great view …More"
PO HOtel Semarang,Antonius Jonathan,4.0,"The staff is pleasant Food is good But the room is not as clean as it used to be The bed and sleeping stuff are not fresh anymore, already yellowing"
PO HOtel Semarang,Wiba Sampoerno,5.0,"Another 5 star hotel, premium place, expensive marble, Large room. Semi indoor pool area. Connected with biggest mall in semarangRooms: 5/5 | Service: 5/5 | Location: 5/5 …More"
PO HOtel Semarang,viet ung,4.0,Everything is fineFoods is not really specialPrice is high but super convenient cause it’s above the mall
PO HOtel Semarang,Yuwanda Anugrah,1.0,"Try to call 4 different number customer service but no answer and when arrive there is no more extra bed cause they not got information about that. How i can tell if they not response the phone, trust me i call that 4 number many times."
PO HOtel Semarang,Suyandi Liyis,3.0,Parking is the main problem. I can't park here during weekend. Gridlock. Outdoor parking located beside the mall also full. The other place to park your car is amaris hotel. Walking about 5-10 minutes.
PO HOtel Semarang,lidia hayaty,5.0,"Always happy to stay here for vacation or work, you all must be here when you come at Semarang, everything was great."
PO HOtel Semarang,Hery Gunawan,5.0,"I love my stay here, great breakfast, and clean roomRooms: 5/5 | Service: 5/5 | Location: 5/5 …More"
PO HOtel Semarang,Loekito Soephomo,3.0,"What they need to improve in their room are the air conditioning and their shower. We cannot sleep at night because the aircon was so hot. It's like there is no air inside the room. I already put like 18c, but still hot. Their services also need to improved a lot.. checkin out process took about 20min waiting ( peak season Dec )."
PO HOtel Semarang,Krishna Wiharsa,2.0,"Conveniently integrated to Paragon Mall and in the heart of Semarang city. Service could be improved. They gave us room at smoking floor even when we have specifically reserved rooms on non-smoking floor, and they could only gave us replacement on the next day. Rooms look rather worn, as I believe it had been previously Crown Hotel."
PO HOtel Semarang,rahmat setiawan15,5.0,"Side by side with paragon mall , suitable for foreigners and tourist to enjoy middle of Semarang for business or pleasure"
PO HOtel Semarang,GARTHINDO channel,4.0,Its just fine hotelCenter of the cityWith largest mall in town with inJust its beggin to old about the room fascilityRooms: 4/5 | Service: 5/5 | Location: 5/5 …More
PO HOtel Semarang,Adhika Susilo,3.0,"Nothing special. Breakfast buffet is good, a lot of menu choices but not pleasant enough for 4 star hotel. Room no 1105. Faucet is broken. For the same price, I'd rather choose another hotel to stay."
PO HOtel Semarang,Ardy Almatsir,4.0,"The hotel need to look at its maintenance program, some lights in the room are out, the hot kettle on/off switch is loose, the shower head is blocked in many points, otherwise it is a great place to stay, located close to interesting places such as the Museum which houses many restaurants."
PO HOtel Semarang,Yosep Uti,5.0,"the location of the hotel is good, it used to be called the crowne plaza hotel, the room lights are not bright, for breakfast there are many variations and the taste is good. next to the hotel there is a mall paragon, easy to find food."
PO HOtel Semarang,Curious Fingers,4.0,"Only stayed 1 night before returning home. Check in took an hour because we ordered connecting rooms or at lease side-by-side rooms (confirmed) but at the time unavailable. For info, we checked in after 2.30 pm. After some pushing, the staff gave us upgraded rooms on 11th floor. The rooms were freezing, so the whole night we turned off all AC. TV wasn't interesting, internet also was barely there, so kids kept on using indosat, which had to be near window. View was excellent, esp at night. Staffs friendly. There's ironing board inside closet although we didn't use it, but surely would be handy when staying longer. Amenities weren't complete, we had to ask for towels and bathroom mat. No tea, no sandals, no pen and paper, and no lock in bathrooms. Bathtub-room door was sliding type, so my toddler couldn't play in tub without flooding the whole room. The good side, it had clothes line. There's shower and closet inside with regular glass doors. Sink was draining slow. I think the bed was too soft, but luckily it didn't cause backpain in the morning. Breakfast was... kids didn't eat much u know. Definitely won't stay again here. The plus was the hotel's right beside mall, so have fun exploring."
PO HOtel Semarang,aditya dhanwantara,3.0,Strategic location but it would be better if the interior maintain in a betterRooms: 3/5 | Service: 4/5 | Location: 5/5 …More
PO HOtel Semarang,Sri m,5.0,Very great experience.. I love the bath tub.. So so comfyService: 5/5 | Location: 5/5 …More
PO HOtel Semarang,Henry Jaya,5.0,Great ppace such modern hotel on the top of a mallRooms: 5/5 | Service: 5/5 | Location: 5/5 …More
PO HOtel Semarang,Uli Simanjuntak,4.0,"the hotel nice, the staff is nice, but for the management kindly pay attention to the staff uniform, i've seen some of the employee's uniform seam was off... It just my personal taste maybe... but for the service nothing is wrong."
PO HOtel Semarang,Raharto Chantel,5.0,The nice hotel in Semarang city. I love it.Rooms: 5/5 | Service: 5/5 | Location: 5/5 …More
PO HOtel Semarang,XI - E - 08 - Clarista Letitia Birawa,1.0,Got a very bad experience while stayed in this hotel. The toilet is worst and there’s no tissues to clean out the wastafel’s area. The door can’t be locked because the handle is brokenRooms: 1/5 | Service: 1/5 | Location: 5/5 …More
PO HOtel Semarang,Pongki Harahap,4.0,Clean and good room with bath up..i just wonder maybe next time will get a large spring bed
PO HOtel Semarang,Peter Kurniawan,5.0,"One of the best hotel in Semarang and connected to shopping mall. Very kind and professional services, spacious and comfortable rooms. The breakfast was really good, with a vast choices of foods. Almost all of them taste really good. They offered fresh juices and you can choose or mix the fruits as you like."
PO HOtel Semarang,andrew yang,1.0,"Poor maintenance, breakfast quality is bad. Staff tried the best to overcome the situation though. Overall not good experience and not upto 5 star hotel quality"
PO HOtel Semarang,Robeth Manurung,4.0,"Good locations and hotel facilities, however, the parking space is very challenging in 5 floors with narrow helical driveway, you should aware while you drive to park your car."
PO HOtel Semarang,Rio,2.0,Good workout facility. Good breakfast with instant ginger from Sidomuncul. However the room we were really really disappointed with the suite room. The carpet was soft but it had so much dust bunny build up. The TV connection was really poor. The toilet couldn't flush properly. We got to go to the club lounge but no one took us there so we had to find it by ourselves. Really not worth staying at the suite room. A normal standard room would have maybe been okay. In total quite disappointed and would not recommend for group setting hotel stay.
PO HOtel Semarang,Yochan Rayon,3.0,"Hotel location almost perfect, on top of Paragon Mall, but with security unto consideration. They separated public area and room floors, and elevator to room floors can only accessible using card key as it's supposed to. The room was great, spacious. They had almost everything. Hotel staffs are nice and helpful, but room service were clumsy. On the first day, they forgot to put shower gel, and on the second day they pick up our bath mat and put nothing as replacement. Other sad thing was the food. Breakfast and catering for meeting lunch can't be said good nor satisfying. Some food are too salty, and the ""fried beef chinese something"" is difficult to chew, almost like chewing rubber band.... Hope they can improve ^^¡"
PO HOtel Semarang,christantosuryo,5.0,"Actually a very comfy hotel, but if you bring car here, it's such a mess in the way out because of the mall, which in the same place. Also, if you check in late at night, with the mall already closed, parking and coming to the mall lobby is harderRooms: 5/5 | Service: 5/5 | Location: 4/5 …More"
PO HOtel Semarang,Faela Sufa,5.0,"We love this hotel. The bed is just very very comfortable. The room is clean and spacious, although it doesn't have a nice view but who cares haha. The breakfast buffet is okay. It connects directly with mall, so quite easy to find something to eat, and the location itself is close to anywhere."
PO HOtel Semarang,Dwi Febriantoko,4.0,"Plus points: large room, bathtub, friendly staffs, good facilities, next to Paragon Mall.Negative points: smelly and dirty-looking towels, dim light in the room and carpets looked old and rundown"
PO HOtel Semarang,Moulidya Dwinta Rosari,3.0,"i couldn't access my room at twice, but went well stay.Rooms: 3/5 | Service: 3/5 | Location: 5/5 …More"
PO HOtel Semarang,Gomos Silitonga,4.0,"The biggest plus for this place is the location. At the center of the city, adjacent to a mall. However, the asset looks old which i think is due to the maintenance. It felt old as well. The fitness is good though, complete tools. Breakfast is so-so, which is a pitty because Semarang is well known for good food."
PO HOtel Semarang,James Lewis,5.0,"Great hotel! Staff is so friendly and they make a enjoyable experience. Lounge is great with a variety of soda, wine, and traditional Indonesian snacks. Breakfast here is by far the best!! Food is just great! They have a huge selection of breakfast items! Breakfast is above average! Hotel room is nice and clean with great views of Semerang."
PO HOtel Semarang,Allen Widjaja,4.0,Strategically located hotel in city center of Semarang. Connect to the mall. Its room rate is the most pricey in the city. Staffs' friendliness is outstanding (reception and restaurant). The room cleanliness and dark lighting can be improved.
PO HOtel Semarang,Florence Lukito,2.0,"Stained damp fabric sofa. Shower has small water pressure, and produce smelly water in the 1st minutes. Unstable toilet seat, not repaired upon request. Over-priced."
PO HOtel Semarang,Hwely Budiman,5.0,"A luxurious 5-star hotel, so strategic, side by side with Paragon Mall, enjoyable breakfast. It's a complete solution for business and family traveller.But, needs some attractions for millenials and more improvement in services"
PO HOtel Semarang,Julia,5.0,"Great location close to the airport and very nice and clean rooms. The only thing I found odd was that they had metal scanners at all the entrances to the hotel but you don't put your bags through them and security barely inspect them so I'm not sure what they prevent. The rooms are pretty spacious, nicely designed with a lot of recessed lighting. The bathrooms include a shower with a separate bathtub and toilets include a bidet cover. What's nice is breakfast is included! While it's not the best, there's an assortment of cuisines so you can find what's to your liking."
PO HOtel Semarang,Raden Arief Nugroho,4.0,"One of the best hotels in Semarang. Recently they changed their name into PO Hotel. So IHG brand should not be used again to refer to the hotel. The quality is more or less the same with IHG standard. Some departments were overhauled. The ins and outs of employees are inevitable. But, still one of the best to stay. A bit pricey but still worth it. Adjacent to one of the biggest and most complete malls in Semarang."
PO HOtel Semarang,Rubi Haliman,5.0,"Visit this PO hotel to attend a conference purpose. Try to buy the croissant, it was superb: crispy outside while soft inside....two thumbs up 👍👍"
PO HOtel Semarang,Michael Indra Setiadi,5.0,Nice hotel and have a full range of breakfast ready. Still a lovely hotel to stay.Rooms: 5/5 | Service: 5/5 | Location: 5/5 …More
PO HOtel Semarang,Dicky C. Muharawan,4.0,"Good hotel, however the cleanliness must be improved. Unfortunately found this maybe due to covid19 pandemic, the cleaning staff are not in their highest performance. However, the service is good and the location perfect, its located adjacent to the shopping mall."
PO HOtel Semarang,Vina92 Purba,5.0,"i think this is one of the best hotel in Semarang City, it connects to the mall so you can easily do shopping, eating, spa, they have supermarket, also the hotel provided room for office meetings, seminars, and even a wedding (huge one). The food is good, many variants taste is 5 star hotel"
PO HOtel Semarang,Eunike Yenny Imelda Burnama,5.0,"Tonight is my last night at this room, I really love this hotel and i guess this is the best hotel in Semarang., located at the heart of Semarang city and connected to the most popular Mall in this town. They have clean and comfy room, friendly staffs who always look after us,giving us warm greetings and best service, excellent! And last thing i have to say,, i’m so in love with their Gym centre which is open for 24hours, so damn good huh? Well..so, this is highly recommended!!"
PO HOtel Semarang,Raditya Adhi,4.0,"Actually the hotel is good, next to shopping mall, in the middle of the city.But my expectation is more for a 5 star hotel"
PO HOtel Semarang,luckyprajitno,5.0,"WONDERFUL place to stay! 5 star hotel with a really great views, but quite hard to contact the Room service and no menus in the room. The hotel ran out of extra bed and no more rooms available so i have to share the room with my parents. The breakfast itself is quite good with a very cheap price for a 5 star hotels and they let the guests to try making their own cappucino with their guide. Love the people and location. Too bad i didnt take any photos because i checked in at the middle of the night already 😅"
PO HOtel Semarang,Rhicke Jennings,4.0,Great support and friendly staff. Roomy and comfortable room with range of T.V. and reasonable internet. Breakfast with many items on a large and well stocked buffet. It hits all the high points and adjacent to the mall. Outstanding local noodles from the stand across the street.
PO HOtel Semarang,ANTI BRANDLOKAL,3.0,"Preferred choice for business and leisure in the vibrant heart of Semarang With contemporary design and extremely spacious rooms, Po Hotel is truly a modern and upscale hotel in Semarang. Perfectly placed within downtown business district, it is an ideal destination for both business and leisure travelers. Adjacent to Paragon Mall, the largest and most modern shopping mall in the city and surrounded by banks, corporate and government offices; the hotel allows you to seamlessly mix business with pleasure. The warm hospitality and thoughtfully designed rooms allow you to relax in comfort and stay energetic. The exclusive restaurants and bar provide varied dining options, catering to international and local palate. With excellent meetings facilities and professional services, Po Hotel is the obvious choice for events and weddings. You can unwind at the hotel’s swimming pool while overlooking the beautiful skyline of Semarang City."
PO HOtel Semarang,Alfredo Di Stefano,5.0,"Very strategic place in semarang. It has very delicious food and beverages. Sushi, meat, and egg which are very tasteful. It has very nice swimming pool and great landscape from the above for seeing Semarang. Nice place to come with our family."
PO HOtel Semarang,Doni Putra Nusantara,5.0,"Few years ago, the hotel is named Crowne Hotel. But now it's named PO Hotel. It's 5 stars extravagant hotel. Generally, many famous people (artist, officials, and etc) were staying here. The room was spacious, the restaurant provides good meals. The hotel is located beside the biggest mall in semarang/Paragon."
PO HOtel Semarang,Agung Pramudianto,5.0,"5star Hotel with the best location. Spacious and comfortable room. Good selection for breakfast. Sky pool on 7th floor.Strange set up for bathtub tho, it's outside of the bathroom. Enjoyable stay, overall"
PO HOtel Semarang,Frekast 88,1.0,"Staffs were not friendly. poor facilities, filthy, where there are some stains on the bed sheets, and no proper towel given!Rooms: 1/5 | Service: 1/5 | Location: 3/5 …More"
PO HOtel Semarang,budi Marto,5.0,"This is a crown that is over done, the bed is so soft the food fro breakfast was super duper with choices galore. I have been to many crown hotel, this place looks and feel like it should have been a Pullman level, The access to the mall downstairs was definitely a total plus as the mall has movie theater and all the food you can imagine. It is a definitely a place i would come back to when I am in town."
PO HOtel Semarang,pascal bauwens,5.0,"For sure this is the best hotel in Semarang. Great location and right in the shopping mall .The rooms are big and nice and very good bed linen . The Breakfast is Amazing. Big choice of Indonesian and western food and maybe the best,professional and friendly service done by Fina and Risky. I remember the names of this 2 lady's because this is far the best service we had in a hotel in Indonesia Congratulations to the team See you very soon on my next trip to Semarang"
PO HOtel Semarang,Oktovani Notosugondo,4.0,"Good place to stay as connected to paragon mall, nice staff and got a lot of food stall surrounding hotel"
